verb	verb_id	object	sentence	phrase
improves	45	uptake	These findings suggest that norepinephrine and high-dose dopamine inhibit hepatic drug uptake and that low-dose DOPAMINE IMPROVES UPTAKE in IPRL .	...dopamine improves uptake in...
depolarizes	-1	neurons	These data indicate , first , that DOPAMINE DEPOLARIZES the striatal large aspiny NEURONS by a D1-mediated suppression of resting K+ conductance and an opening of a nonselective cation channel and , second , that both mechanisms are mediated by an adenylyl cyclase-dependent pathway .	...dopamine depolarizes the striatal large aspiny neurons by...
play	6	role	It also suggests that DOPAMINE or some other D3r ligand may PLAY a ROLE in oligodendrocyte differentiation and/or the formation of myelin by mature oligodendrocytes .	...dopamine or some other D3r ligand may play a role in...
has	4	effect	Since DOPAMINE in the medial prefrontal cortex HAS an inhibitory EFFECT on nucleus accumbens dopamine levels and locomotor activity , the role of medial prefrontal cortex dopamine tolerance in the expression of sensitized locomotor behavior was further examined by injection of D-amphetamine sulfate into the prelimbic portion of the medial prefrontal cortex just prior to cocaine challenge in cocaine-sensitized rats .	...dopamine in the medial prefrontal cortex has an inhibitory effect on...
increases	17	concentrations	Endogenous DOPAMINE INCREASES extracellular CONCENTRATIONS of glutamate and GABA in striatum of the freely moving rat : involvement of D1 and D2 dopamine receptors .	...dopamine increases extracellular concentrations of...
plays	3	role	These data suggest that endogenous DOPAMINE , through both D1 and D2 dopamine receptors , PLAYS a ROLE in releasing glutamate and GABA in striatum of the freely moving rat .	...dopamine , through both D1 and D2 dopamine receptors , plays a role in...
convert	-1	inhibitor	It is well documented that DOPAMINE and dopamine D1 agonists CONVERT the protein phosphatase-1 INHIBITOR , DARPP-32 , from its dephosphorylated , inactive form into its Thr34-phosphorylated , active form , and that these effects on DARPP-32 constitute essential components of the mechanism by which dopamine and D1 agonists achieve their biological effects .	...dopamine and dopamine D1 agonists convert the protein phosphatase-1 inhibitor ,...
modulates	10	transmission	In turn , DOPAMINE MODULATES excitatory TRANSMISSION mediated by frontal and temporal cortical projections to the basal ganglia and other regions .	...dopamine modulates excitatory transmission mediated...
had	5	no	Adrenoceptor , DOPAMINE , acetylcholine , GABA-receptor agents and antagonists of NMDA receptors HAD minor or NO effect .	...dopamine , acetylcholine , GABA-receptor agents and antagonists of NMDA receptors had minor or no effect...
influence	34	physiology	Modulation of multisecond oscillations in firing rate represents a novel means by which DOPAMINE can INFLUENCE globus pallidus PHYSIOLOGY .	...dopamine can influence globus pallidus physiology ....
stimulated	14	transcription	Our transient expression data revealed that DOPAMINE STIMULATED TRANSCRIPTION through the NF-kappaB element present in the long terminal repeat .	...dopamine stimulated transcription through...
modify	76	function	Our findings confirm that DOPAMINE , but not adrenaline , can MODIFY platelet FUNCTION in the cerebral vasculature and these observations may have implications for current and potential therapeutic uses of dopamine and selective dopaminergic compounds .	...dopamine , but not adrenaline , can modify platelet function in...
modulates	10	neurons	This review covers some recent findings of the electrophysiological mechanisms through which mesocortical DOPAMINE MODULATES prefrontal cortical NEURONS .	...dopamine modulates prefrontal cortical neurons ....
depolarizes	-1	subtype	In addition , DOPAMINE mainly DEPOLARIZES the fast-spiking SUBTYPE of local GABAergic interneurons that connect the pyramidal neurons .	...dopamine mainly depolarizes the fast-spiking subtype of...
had	5	effect	In contrast , DOPAMINE and endogenous monoamine oxidase HAD no EFFECT on mitochondrial swelling .	...dopamine and endogenous monoamine oxidase had no effect on...
sculpt	-1	pattern	The monoamines DOPAMINE ( DA ) , serotonin ( 5HT ) , and octopamine ( Oct ) can each SCULPT a unique motor PATTERN from the pyloric network in the stomatogastric ganglion ( STG ) of the spiny lobster Panulirus interruptus .	...dopamine ( DA ) , serotonin ( 5HT ) , and octopamine ( Oct ) can each sculpt a unique motor pattern from...
modulates	10	activity	Since DOPAMINE ( DA ) MODULATES carotid nerve chemosensory ACTIVITY , we searched for the presence of DA sensitivity at the perikarya of these neurons in the cat petrosal ganglion superfused in vitro .	...dopamine ( DA ) modulates carotid nerve chemosensory activity ,...
blocked	74	apoptosis	Both DOPAMINE ( 100 microM ) and the D1-like agonists SKF-38393 , 6-chloro-7,8-dihydroxy-1-phenyl-2,3,4,5-tetrahydro-1H-3-benzazepine ( 6-Cl-PB ) , and (+/-)-2-amino-6,7-dihydroxy-1,2,3,4-tetrahydronaphthalene ( 100 microM ) BLOCKED APOPTOSIS induced in the neuroblastic layer by the protein synthesis inhibitor anisomycin .	...dopamine ( 100 microM ) and the D1-like agonists SKF-38393 , 6-chloro-7,8-dihydroxy-1-phenyl-2,3,4,5-tetrahydro-1H-3-benzazepine ( 6-Cl-PB ) , and (+/-)-2-amino-6,7-dihydroxy-1,2,3,4-tetrahydronaphthalene ( 100 microM ) blocked apoptosis induced...
induced	12	increase	Both DOPAMINE and D1-like agonists INDUCED a five- to sevenfold INCREASE in the intracellular concentration of cyclic AMP in the retina of newborn rats .	...dopamine and D1-like agonists induced a five- to sevenfold increase in...
guides	-1	long-term	A neural network model of how DOPAMINE and prefrontal cortex activity GUIDES short- and LONG-TERM information processing within the cortico-striatal circuits during reward-related learning of approach behavior is proposed .	...dopamine and prefrontal cortex activity guides short- and long-term information...
plays	3	role	The early appearance of dopamine-immunoreactive neurons and the effects of dopamine on stage 5 antennal-lobe neurons in vitro support the view that DOPAMINE PLAYS a ROLE in the developing brain of the honey bee .	...dopamine plays a role in...
exert	28	influence	We therefore report the first showing of a functional descending pathway in an in vitro slice preparation describing both the transmitter and the receptor subtype involved and physiologically show that DOPAMINE may EXERT an indirect excitatory INFLUENCE on sympathetic preganglionic neurones possibly via interneurones present in the spinal cord .	...dopamine may exert an indirect excitatory influence on...
exhibited	55	pattern	Caudate-putamen DOPAMINE EXHIBITED a PATTERN of increasing response during an acute MP binge but pronounced tolerance developed to this effect after multiple binges .	...dopamine exhibited a pattern of...
had	5	effect	At 37 degrees C , DOPAMINE and adrenaline HAD a harmful EFFECT at both doses ; noradrenaline was harmful at a high dose but beneficial at a low dose .	...dopamine and adrenaline had a harmful effect at...
had	5	effect	At 20 degrees C , adrenaline , DOPAMINE , and noradrenaline HAD a harmful EFFECT at high doses but no harmful effect at low doses .	...dopamine , and noradrenaline had a harmful effect at...
modulates	10	activity	In vivo evidence that endogenous DOPAMINE MODULATES sympathetic ACTIVITY in man .	...dopamine modulates sympathetic activity in...
modulates	10	transmission	To examine whether DOPAMINE MODULATES cortical N-methyl-D-aspartate receptor-mediated glutamate TRANSMISSION , whole-cell recordings were made from identified pyramidal cells located in layers V and VI of the medial prefrontal cortex of the rat using a slice preparation .	...dopamine modulates cortical N-methyl-D-aspartate receptor-mediated glutamate transmission ,...
enhanced	33	current	At low concentrations ( & lt;50 microM ) , DOPAMINE ENHANCED the N-methyl-D-aspartate CURRENT , whereas at higher concentrations , dopamine suppressed the current .	...dopamine enhanced the N-methyl-D-aspartate current ,...
suppressed	35	current	At low concentrations ( & lt;50 microM ) , dopamine enhanced the N-methyl-D-aspartate current , whereas at higher concentrations , DOPAMINE SUPPRESSED the CURRENT .	...dopamine suppressed the current ....
activates	40	receptors	The above results suggest that dopamine at low concentrations acts preferentially on D1-like receptors to promote N-methyl-D-aspartate receptor-mediated transmission , while at high concentrations DOPAMINE also ACTIVATES D2-like RECEPTORS , leading to a suppression of the N-methyl-D-aspartate function .	...dopamine also activates D2-like receptors ,...
regulates	22	expression	The results suggest that DOPAMINE REGULATES D1 receptor gene and protein EXPRESSION in a bimodal manner , partly through activation of the receptor promoter .	...dopamine regulates D1 receptor gene and protein expression in...
regulates	22	vasodilation	The uneven distribution of dopamine D1 and D2 receptor mRNAs in the rat systemic vasculatures and pulmonary artery suggests that DOPAMINE differentially REGULATES the VASODILATION of the systemic and pulmonary arteries through the differential stimulation of dopamine D1 and D2 receptor .	...dopamine differentially regulates the vasodilation of...
had	5	effect	In contrast , in the turtle olfactory bulb , neither GABA nor DOPAMINE HAD any EFFECT on receptor cell action potentials as measured with voltage-sensitive dyes .	...dopamine had any effect on...
mediate	37	receptors	These results indicate that in the turtle , GABA and DOPAMINE MEDIATE presynaptic inhibition not by affecting action potentials directly , as in the lobster , but by reducing calcium influx via GABA(B ) and dopamine D(2 ) RECEPTORS .	...dopamine mediate presynaptic inhibition not by affecting action potentials directly , as in the lobster , but by reducing calcium influx via GABA(B ) and dopamine D(2 ) receptors ....
influences	38	development	This study was undertaken to determine how DOPAMINE INFLUENCES cortical DEVELOPMENT .	...dopamine influences cortical development ....
inhibited	2	accumulation	In CHO cells expressing D4.4 receptors ( CHO/D4 cells ) , DOPAMINE INHIBITED forskolin-stimulated cyclic AMP ACCUMULATION ( Emax 56+/-1 % inhibition , pEC50 7.4+/-0.1 , n=10 ) .	...dopamine inhibited forskolin-stimulated cyclic AMP accumulation (...
inhibited	2	activity	In the present study , we have found that in this preparation , DOPAMINE INHIBITED significantly ( by approximately 25 % ) the ACTIVITY of the alpha3 and/or alpha2 isoforms , but not the alpha1 isoform , of Na+,K+-ATPase .	...dopamine inhibited significantly ( by approximately 25 % ) the activity of...
using	-1	gradient	[ Concentrating DOPAMINE in liposomes USING transmembrane GRADIENT of ammonium sulfate ] .	...dopamine in liposomes using transmembrane gradient of...
have	9	influence	It is concluded that low dose dopexamine and DOPAMINE HAVE no INFLUENCE on pHi during and after cardiac surgery .	...dopamine have no influence on...
inhibited	2	secretion	Dihydroxy-1-phenylalanine and serotonin augmented while 5-hydroxy-1-tryptophan and DOPAMINE INHIBITED calcium SECRETION .	...dopamine inhibited calcium secretion ....
generate	87	radicals	Autoxidation is one of the two major routes by which DOPAMINE and dopa metabolism may GENERATE oxygen free RADICALS .	...dopamine and dopa metabolism may generate oxygen free radicals ....
increased	1	supply	Fenoldopam maintained systemic oxygen extraction constant by increasing both oxygen supply and demand , while noradrenaline and DOPAMINE INCREASED oxygen SUPPLY more than demand , thus decreasing oxygen extraction .	...dopamine increased oxygen supply more...
increased	1	delivery	Both DOPAMINE and fenoldopam INCREASED oxygen DELIVERY to the splanchnic organs while noradrenaline reduced it .	...dopamine and fenoldopam increased oxygen delivery to...
modulate	15	responses	This study also suggests that DOPAMINE may MODULATE AMPA/kainate RESPONSES through D1 receptors .	...dopamine may modulate AMPA/kainate responses through...
restored	94	microcirculation	In rats pretreated with indomethacin , with or without N omega-nitro-L-arginine methyl ester HCl , DOPAMINE RESTORED renal MICROCIRCULATION and ameliorated outer medullary hypoxia .	...dopamine restored renal microcirculation and...
attracted	-1	attention	However , a conjugated form of the catecholamine , DOPAMINE has recently ATTRACTED much ATTENTION because it is present at high levels in the plasma of humans and experimental animals .	...dopamine has recently attracted much attention because...
has	4	effect	Endogenous DOPAMINE HAS a tonic inhibitory EFFECT on aldosterone release .	...dopamine has a tonic inhibitory effect on...
inhibits	0	release	Dopamine antagonists enhance the rise in plasma norepinephrine levels during exercise , indicating that endogenous DOPAMINE also INHIBITS norepinephrine RELEASE .	...dopamine also inhibits norepinephrine release ....
plays	3	role	Several studies have suggested that DOPAMINE ( DA ) PLAYS a major ROLE in cardiovascular functions .	...dopamine ( DA ) plays a major role in...
involves	-1	stimulation	We reported a novel intracellular mechanism of renal Na-K-ATPase regulation by DOPAMINE ( DA ) in the rat cortical collecting duct ( CCD ) , which INVOLVES STIMULATION of protein kinase A ( PKA ) and phospholipase A2 ( PLA2 ) .	...dopamine ( DA ) in the rat cortical collecting duct ( CCD ) , which involves stimulation of...
has	4	role	Although DOPAMINE ( DA ) HAS an important ROLE also outside the central nervous system , the physiological significance of DA in the peripheral plasma is not clearly known .	...dopamine ( DA ) has an important role also...
exerts	11	effect	Renal proximal tubular Na , K-ATPase plays an important role in the maintenance of sodium homeostasis and it is known that DOPAMINE ( DA ) EXERTS an inhibitory EFFECT on the activity of this enzyme .	...dopamine ( DA ) exerts an inhibitory effect on...
constitute	-1	most	Although free and conjugated DOPAMINE ( DA ) CONSTITUTE MOST of the plasma and urine catecholamine pool , the diagnostic significance of DA estimation for the evaluation of illness is not clear .	...dopamine ( DA ) constitute most of...
induces	18	recovery	Low-dose DOPAMINE INDUCES early RECOVERY of recombinant interleukin-2 - -impaired renal function .	...dopamine induces early recovery of...
prevented	56	toxicity	Here we show that DOPAMINE , at a low dose of 2 micrograms/kg/min , completely PREVENTED renal TOXICITY induced by rIL-2 .	...dopamine , at a low dose of 2 micrograms/kg/min , completely prevented renal toxicity induced...
affect	19	count	4 patients were receiving DOPAMINE , which did not AFFECT the GR COUNT .	...dopamine , which did not affect the GR count ....
increased	1	rate	At the higher dose both DOPAMINE and epinine significantly INCREASED Psyst and heart RATE , while only epinine significantly increased Pdiast .	...dopamine and epinine significantly increased Psyst and heart rate ,...
increased	1	natriuresis	In addition , both DOPAMINE and epinine significantly INCREASED diuresis and NATRIURESIS ; in contrast , only dopamine , but not epinine dose-dependently increased plasma noradrenaline levels .	...dopamine and epinine significantly increased diuresis and natriuresis ;...
increased	1	levels	In addition , both dopamine and epinine significantly increased diuresis and natriuresis ; in contrast , only DOPAMINE , but not epinine dose-dependently INCREASED plasma noradrenaline LEVELS .	...dopamine , but not epinine dose-dependently increased plasma noradrenaline levels ....
decreases	41	Bmax	These data suggest that DOPAMINE DECREASES BMAX for D1 receptors through a high affinity , guanine nucleotide-sensitive agonist binding site , but fail to reveal D1:D2 interactions at this synaptic level .	...dopamine decreases Bmax for...
stimulate	25	secretion	Previous results have shown that both DOPAMINE ( DA ) and norepinephrine ( NE ) STIMULATE GnRH SECRETION in GT1 neuronal cell lines .	...dopamine ( DA ) and norepinephrine ( NE ) stimulate GnRH secretion in...
modulates	10	activity	However , it has not been established whether DOPAMINE also MODULATES pyramidal cell ACTIVITY indirectly through synapses on gamma-aminobutyric acid ( GABA ) interneurons , and whether such inputs differ across cortical regions and species .	...dopamine also modulates pyramidal cell activity indirectly...
exerts	11	influences	The current results suggest that DOPAMINE injected into the ZI EXERTS inhibitory INFLUENCES on drinking behavior mediated by D2 type receptor .	...dopamine injected into the ZI exerts inhibitory influences on...
received	-1	attention	In this respect DOPAMINE and noradrenaline have RECEIVED much ATTENTION .	...dopamine and noradrenaline have received much attention ....
displaced	100	binding	The findings that DOPAMINE DISPLACED [3H]SCH 23390 BINDING in the submicromolar range suggest that labelling of a dopamine D5 ( or D1B ) receptor subtype .	...dopamine displaced [3H]SCH 23390 binding in...
inhibit	13	cyclase	In order to study the activation mechanism of heterotrimeric G-proteins by agonist-liganded receptors , GTP gamma S binding to membranes was measured in rat adenohypophyseal cells after addition of DOPAMINE ( DA ) or vasoactive intestinal peptide ( VIP ) , which , respectively , INHIBIT and activate pituitary adenylyl CYCLASE .	...dopamine ( DA ) or vasoactive intestinal peptide ( VIP ) , which , respectively , inhibit and activate pituitary adenylyl cyclase ....
modulates	10	co-transport	Locally formed DOPAMINE MODULATES renal Na-Pi CO-TRANSPORT through DA1 and DA2 receptors .	...dopamine modulates renal Na-Pi co-transport through...
exert	28	effects	Hence DOPAMINE can EXERT direct and indirect renal EFFECTS .	...dopamine can exert direct and indirect renal effects ....
have	9	potential	Expectations that low-dose DOPAMINE could HAVE a renal-sparing POTENTIAL did not prove true .	...dopamine could have a renal-sparing potential did...
resemble	-1	other	Serotonin and DOPAMINE RESEMBLE each OTHER in terms of their synthetic and degradative pathways , as well as in terms of structural features .	...dopamine resemble each other in...
plays	3	role	This study suggests that DOPAMINE PLAYS a more important ROLE than serotonin in the mechanism of irreversible destruction of neurons during moderate hypoxia .	...dopamine plays a more important role than...
have	9	roles	The results of this study suggest that DOPAMINE and 5HT HAVE opposing ROLES in modulating GABA input into VTA dopamine neurons .	...dopamine and 5HT have opposing roles in...
has	4	effect	Therefore , the results of the present study indicate that in marmosets DOPAMINE HAS a inhibiting EFFECT on the levels of striatal enkephalin , while its effect on substance P ( SP ) appears to be absent .	...dopamine has a inhibiting effect on...
enhances	36	release	By activating these receptors , exogenous DOPAMINE ENHANCES the RELEASE of GABA .	...dopamine enhances the release of...
enhances	36	caudate-putamen	The results indicate that endogenous DOPAMINE ENHANCES GABA release from striatal terminals in the pars reticulata of the substantia nigra , entopeduncular nucleus and CAUDATE-PUTAMEN .	...dopamine enhances GABA release from striatal terminals in the pars reticulata of the substantia nigra , entopeduncular nucleus and caudate-putamen ....
inhibited	2	binding	GBR-12909 inhibited 80 - 90 % of the binding in most regions , whereas DOPAMINE only INHIBITED the BINDING in the striatum .	...dopamine only inhibited the binding in...
utilize	-1	metabolites	More importantly , the action of neurotransmitters such as DOPAMINE which UTILIZE fatty acids METABOLITES as intracellular mediators , could be influenced by the levels of 2C and 4A P450s .	...dopamine which utilize fatty acids metabolites as...
have	9	role	These results suggest that tricyclic antidepressants altered neurotransmission according to the brain region , and the hippocampal norepinephrine and 5-HT and/or the striatal DOPAMINE may HAVE a significant ROLE for the expression of antidepressant action of tricyclic antidepressants .	...dopamine may have a significant role for...
modulate	15	autofeedback	In the intact retina , DOPAMINE may MODULATE GABA-mediated chemical coupling and AUTOFEEDBACK in horizontal cells .	...dopamine may modulate GABA-mediated chemical coupling and autofeedback in...
have	9	mixture	Our results suggest that L-DOPA and DOPAMINE might HAVE a complex MIXTURE of pro- and anti- oxidant effects , which could contribute to tissue damage due to oxidative stress in Parkinson 's disease and other neurological disorders .	...dopamine might have a complex mixture of...
reduced	20	amplitude	Bath-applied DOPAMINE ( DA ) REDUCED evoked EPSC AMPLITUDE by up to 54.2 + /- 2.3 % with an IC50 of 19.9 microM in normal Krebs solution ( 2.5 mM Ca2 + , 1.2 mM Mg2 + ) without effect on postsynaptic holding current .	...dopamine ( DA ) reduced evoked EPSC amplitude by...
caused	8	relaxation	In the 1st week of postnatal life ( pre-innervation period ) , noradrenaline ( NA ) and 5-hydroxytryptamine ( 5-HT ) produced contraction , whereas isoprenaline ( ISO ) and DOPAMINE ( DA ) CAUSED RELAXATION .	...dopamine ( DA ) caused relaxation ....
affects	29	morphogenesis	We therefore investigated whether and how DOPAMINE AFFECTS the MORPHOGENESIS of striatal target neurons .	...dopamine affects the morphogenesis of...
inhibited	2	effect	Staurosporine and DOPAMINE INHIBITED the potentiating EFFECT of SP on cAMP accumulation .	...dopamine inhibited the potentiating effect of...
contracted	75	concentrations	Under basal conditions , DOPAMINE neither CONTRACTED nor relaxed the gallbladder muscle between 10(-6 ) and 10(-4 ) M CONCENTRATIONS when added directly to the organ bath .	...dopamine neither contracted nor relaxed the gallbladder muscle between 10(-6 ) and 10(-4 ) M concentrations when...
label	108	receptors	Tritiated haloperidol and tritiated DOPAMINE LABEL postsynaptic dopamine RECEPTORS in mammalian brain .	...dopamine label postsynaptic dopamine receptors in...
regulates	22	production	We postulate that DOPAMINE REGULATES the PRODUCTION of prostaglandin in human decidua via DA-1 receptors .	...dopamine regulates the production of...
plays	3	role	Therefore , it is often assumed that DOPAMINE PLAYS a ROLE in amphetamine-induced subjective effects in humans and it would be reasonable to expect that dopamine antagonists would block the subjective effects of amphetamine .	...dopamine plays a role in...
have	9	effects	A conclusion is made that the nigrostriatal DOPAMINE and intrastriatal acetylcholine HAVE the opposite EFFECTS on the main efferent outputs of striatum , including the expression of peptides which determines their involvement .	...dopamine and intrastriatal acetylcholine have the opposite effects on...
limits	-1	binding	Endogenous DOPAMINE LIMITS the BINDING of antipsychotic drugs to D3 receptors in the rat brain : a quantitative autoradiographic study .	...dopamine limits the binding of...
affected	49	perfusion	We speculated that despite an oxygen transport increase , dobutamine and DOPAMINE have AFFECTED differently gastric mucosal PERFUSION in septic patients .	...dopamine have affected differently gastric mucosal perfusion in...
mediates	24	reinforcement	The hypothesis that DOPAMINE MEDIATES ethanol REINFORCEMENT in AA rats is not supported by the results .	...dopamine mediates ethanol reinforcement in...
showed	21	levels	Using high-performance liquid chromatography ( HPLC ) techniques , we found that serotonin and DOPAMINE SHOWED lower LEVELS in the old group .	...dopamine showed lower levels in...
increased	1	efficiency	Isoproterenol and DOPAMINE INCREASED EFFICIENCY .	...dopamine increased efficiency ....
accelerate	-1	heart	Serotonin , octopamine , norepinephrine , DOPAMINE , and acetylcholine ACCELERATE the HEART , in that order of potency .	...dopamine , and acetylcholine accelerate the heart ,...
inhibits	0	secretion	This in vivo result supports the hypothesis that DOPAMINE INHIBITS GnRH SECRETION by presynaptic inhibition in the lateral median eminence .	...dopamine inhibits GnRH secretion by...
plays	3	role	Thus , the present study describes functional evidence of the link between the rostral accumbens and the extended amygdala and demonstrates that DOPAMINE in the rostral accumbens PLAYS an important ROLE in the central response to cocaine .	...dopamine in the rostral accumbens plays an important role in...
inhibits	0	influx	Together , these results demonstrate that , in rat aortic smooth muscle cells , 1 ) DOPAMINE INHIBITS Na+/H+ exchange-mediated Na+ INFLUX , 2 ) dopamine inhibits Na+ pump-mediated Na+ efflux , 3 ) these effects of dopamine are mediated by an increase in cellular cAMP and , at least in the case of inhibition of the Na+ efflux , by the activation of protein kinase A , and 4 ) dopamine causes either small or no changes in [Na+]i , due to almost equal inhibition of Na+ influx and Na+ efflux .	...dopamine inhibits Na+/H+ exchange-mediated Na+ influx ,...
inhibits	0	efflux	Together , these results demonstrate that , in rat aortic smooth muscle cells , 1 ) dopamine inhibits Na+/H+ exchange-mediated Na+ influx , 2 ) DOPAMINE INHIBITS Na+ pump-mediated Na+ EFFLUX , 3 ) these effects of dopamine are mediated by an increase in cellular cAMP and , at least in the case of inhibition of the Na+ efflux , by the activation of protein kinase A , and 4 ) dopamine causes either small or no changes in [Na+]i , due to almost equal inhibition of Na+ influx and Na+ efflux .	...dopamine inhibits Na+ pump-mediated Na+ efflux ,...
