verb	verb_id	object	sentence	phrase
inhibits	0	secretion	These observations demonstrate that the stimulation of prolactin release by dopamine withdrawal is accompanied by a redistribution of cellular Ca2 + and support the hypothesis that DOPAMINE INHIBITS SECRETION by decreasing Ca2 + influx in the mammotroph cell .	...dopamine inhibits secretion by...
showed	21	differences	Serum DOPAMINE , cortisol and homovanillic acid SHOWED no significant DIFFERENCES .	...dopamine , cortisol and homovanillic acid showed no significant differences ....
exerts	11	influence	The results show that in the rat substantia nigra most of the 3H-SCH 23390 binding sites have a presynaptic localization on the striato-nigral GABAergic afferent terminals and suggest that DOPAMINE released from nigral dendrites EXERTS a tonic INFLUENCE on these presynaptic D-1 dopamine receptors .	...dopamine released from nigral dendrites exerts a tonic influence on...
has	4	effects	In contrast , L-DOPA did not alter RCGU in the globus pallidus ( GP ) , supporting the thesis that DOPAMINE ( DA ) HAS different EFFECTS on striatal outflow to the GP compared with outflow to both the EP and SNr .	...dopamine ( DA ) has different effects on...
had	5	effect	Further , DOPAMINE HAD no EFFECT on the K+-induced AVP release although a crude extract of the pars intermedia abolished the electrically-evoked and reduced considerably the potassium-evoked AVP release .	...dopamine had no effect on...
affect	19	mechanism	It is concluded that in the neurohypophysis neither Leu- and Met-enkephalin nor DOPAMINE AFFECT the secretion-coupling MECHANISM at the level of the neurosecretory nerve endings .	...dopamine affect the secretion-coupling mechanism at...
play	6	role	These findings suggest that DOPAMINE may not PLAY a significant ROLE in the natriuresis of starvation .	...dopamine may not play a significant role in...
produces	32	increase	We conclude that low-dose DOPAMINE PRODUCES a significant INCREASE in urine production with resolution of oliguria in severe preeclampsia .	...dopamine produces a significant increase in...
play	6	role	Recent studies have suggested that DOPAMINE ( DA ) formed within the kidney may PLAY an important ROLE in promoting sodium excretion , and that renal production and excretion of DA is determined by dietary sodium intake .	...dopamine ( DA ) formed within the kidney may play an important role in...
play	6	role	Hypothalamic DOPAMINE may PLAY a ROLE in inducing prolactin in pituitary cells .	...dopamine may play a role in...
play	6	role	It seems , then , that hypothalamic dopaminergic neurons precede the functional differentiation of prolactin cells in the developing brains and that hypothalamic DOPAMINE may PLAY an important ROLE in producing prolactin in the anterior pituitary during development .	...dopamine may play an important role in...
enhanced	33	adhesion	It was shown that DOPAMINE ENHANCED spontaneous lymphocyte ADHESION , with the optimal concentrations of the substance for the realization of a stimulating effect being 10(-4)-10(-6 ) M. The effect of the enhancement was pharmacologically specific , as it was completely blocked by dopamine receptor-blocker -- haloperidol .	...dopamine enhanced spontaneous lymphocyte adhesion ,...
depresses	86	response	This indicates that DOPAMINE DEPRESSES the normoxic ventilatory RESPONSE to carbon dioxide .	...dopamine depresses the normoxic ventilatory response to...
reduces	42	response	Intravenous DOPAMINE REDUCES the ventilatory RESPONSE to both hypoxia and hypercapnia but preserves the augmentation of hypoxic ventilatory drive by hypercapnia .	...dopamine reduces the ventilatory response to...
increased	1	Ppa	At 20 micrograms/kg/min ( n = 8 dogs ) , DOPAMINE and dobutamine INCREASED PPA at the lowest Cl ( 2 to 4 and 2 to 3 L/min/m2 , respectively ) at 0.4 FIO2 , and attenuated hypoxia-induced increases in Ppa over the entire range of Cl .	...dopamine and dobutamine increased Ppa at...
exerted	77	effects	We concluded that at dosages as great as 20 micrograms/kg/min , as generally given in clinical practice , DOPAMINE and dobutamine EXERTED similar EFFECTS upon the pulmonary circulation of intact dogs ; either no change or an increase in hyperoxic pulmonary vascular tone and either no change or an attenuation of hypoxic pulmonary vasoconstriction .	...dopamine and dobutamine exerted similar effects upon...
lack	-1	nitrogen	The mechanism-based inhibition of dopamine beta-hydroxylase ( DBH ; EC 1.14.17.1 ) by p-cresol ( 4-methylphenol ) and other simple structural analogues of DOPAMINE , which LACK a basic side-chain NITROGEN , is reported .	...dopamine , which lack a basic side-chain nitrogen ,...
activate	43	alpha-adrenoceptors	These results suggest that DOPAMINE and NA released during depolarization by K+ ACTIVATE prejunctional dopamine and ALPHA-ADRENOCEPTORS , respectively , thereby playing a role in the control of transmitter release .	...dopamine and NA released during depolarization by K+ activate prejunctional dopamine and alpha-adrenoceptors ,...
induces	18	degree	We conclude that critically ill patients with nonthyroidal illness not receiving dopamine have normal pituitary-thyroid function , whereas DOPAMINE INDUCES some DEGREE of secondary hypothyroidism .	...dopamine induces some degree of...
had	5	effect	Low dose DOPAMINE ( 0.1 microgram min-1 kg-1 ) HAD a slight but insignificant EFFECT with decreased prolactin levels at the end of the infusion whereas the higher dopamine dose was associated with significantly lower prolactin levels during and throughout the infusion .	...dopamine ( 0.1 microgram min-1 kg-1 ) had a slight but insignificant effect with...
had	5	effect	ATP release from freshly isolated cells by 5 microM nicotine was only weakly inhibited by adrenaline and noradrenaline and even then required high concentrations ( greater than 500 microM ) , while DOPAMINE ( 1 microM-1 mM ) and isoproterenol ( 100 microM ) HAD no EFFECT .	...dopamine ( 1 microM-1 mM ) and isoproterenol ( 100 microM ) had no effect ....
inhibits	0	influx	These data complement and extend reported fluorescent dye studies and suggest that DOPAMINE primarily INHIBITS calcium INFLUX , thereby reducing intracellular calcium levels , which leads to suppression of prolactin release and is manifest secondarily as a reduction in fractional 45Ca2 + efflux .	...dopamine primarily inhibits calcium influx ,...
inhibited	2	elongation	Both DOPAMINE and serotonin INHIBITED growth cone motility and ELONGATION of neurites .	...dopamine and serotonin inhibited growth cone motility and elongation of...
produced	7	contractions	Vasopressin , 5-hydroxytryptamine ( 5-HT ) , NA ( in the presence of cocaine ) , prostaglandin F2 alpha ( PGF2 alpha ) and DOPAMINE ( DA ) PRODUCED concentration-dependent CONTRACTIONS in the mentioned order of potency .	...dopamine ( DA ) produced concentration-dependent contractions in...
prevents	105	of	Acetylcholine is known to stimulate the secretion of growth hormone and prolactin and the efflux of 86Rb from bovine anterior pituitary cells : DOPAMINE PREVENTS the stimulation OF 86Rb efflux and of prolactin but not growth hormone secretion .	...dopamine prevents the stimulation of 86Rb...
increased	1	%	Extracellular DOPAMINE INCREASED 37 % when the animals pressed a lever for food reward .	...dopamine increased 37 % when...
inhibits	0	release	However , DOPAMINE INHIBITS prolactin RELEASE from these cells only when the basal rate of prolactin release is augmented by increasing the intracellular and/or extracellular calcium concentration of the tumour cells .	...dopamine inhibits prolactin release from...
stimulated	14	activity	Ca2+/calmodulin stimulated striatal and hippocampal adenylate cyclase activity by 1.4- and 2.7-fold respectively , while DOPAMINE and vasoactive intestinal peptide ( VIP ) STIMULATED the enzyme ACTIVITY of these respective regions by 1.3- and 2-fold .	...dopamine and vasoactive intestinal peptide ( VIP ) stimulated the enzyme activity of...
showed	21	variation	Hypothalamic DOPAMINE ( DA ) and noradrenaline ( NA ) , on the other hand , SHOWED marked daily VARIATION in their levels during all the three seasons with peak values in the photophase .	...dopamine ( DA ) and noradrenaline ( NA ) , on the other hand , showed marked daily variation in...
evoked	73	release	Endogenous DOPAMINE , released from dopaminergic amacrine neurons by the indirect amines tyramine or D-amphetamine EVOKED the calcium-dependent RELEASE of 3H-acetylcholine from rabbit retina .	...dopamine , released from dopaminergic amacrine neurons by the indirect amines tyramine or D-amphetamine evoked the calcium-dependent release of...
reduce	44	lethality	However , DOPAMINE alone did not REDUCE the LETHALITY .	...dopamine alone did not reduce the lethality ....
increases	17	flow	The present results suggest that DOPAMINE INCREASES abdominal blood FLOW and improves the energy metabolism in the liver during hypovolemic shock .	...dopamine increases abdominal blood flow and...
exerts	11	effect	This suggests that DOPAMINE EXERTS a tonic inhibitory EFFECT on the expression of the proenkephalin gene in all of the enkephalinergic neurons of the caudate-putamen .	...dopamine exerts a tonic inhibitory effect on...
decreased	23	incorporation	In vitro DOPAMINE ( DA ) DECREASED the INCORPORATION of 32P into PI , both in young and old pituitary glands , and inhibited prolactin secretion into the incubation medium .	...dopamine ( DA ) decreased the incorporation of...
have	9	role	These results suggest that DOPAMINE and noradrenaline present in the ectopic pituitary tissue HAVE a ROLE in mediating prolactin release from pituitary transplants .	...dopamine and noradrenaline present in the ectopic pituitary tissue have a role in...
inhibits	0	phases	In related experiments , the short-term action of dopamine was manifested also upon in vitro transformation , repletion and release of in vivo labelled [3H]PRL , thus indicating that DOPAMINE INHIBITS all PHASES of PRL secretion by the lactating rat anterior pituitary ( AP ) .	...dopamine inhibits all phases of...
had	5	effect	These effect of bromocriptine were not blocked by haloperidol , known as dopamine antagonist , at the same concentration as bromocriptine , and DOPAMINE HAD no EFFECT on (3H)-uridine uptake by the cells .	...dopamine had no effect on...
limit	-1	responses	We conclude that DOPAMINE in the carotid body does not LIMIT ventilatory RESPONSES to hypoxia during acclimatization to sustained hypoxia .	...dopamine in the carotid body does not limit ventilatory responses to...
induces	18	elevation	Additionally , DOPAMINE INDUCES a massive [Na(+)](i ) ELEVATION via the Na(+)K(+)2Cl(- ) cotransporter ( NKCC ) .	...dopamine induces a massive [Na(+)](i ) elevation via...
induces	18	elevation	These results indicate that DOPAMINE INDUCES a massive NKCC-mediated ELEVATION in [Na(+)](i ) , which reverses the NCE activity into the reverse mode causing a graded [Ca(2+)](i ) elevation in the duct cells .	...dopamine induces a massive NKCC-mediated elevation in...
produce	52	interference	The selectivity of the method was good , because a series of common ions or excipients , such as K(+ ) , Ba(2 + ) , CO(3)(2- ) , NO(3)(- ) , SO(4)(2- ) , PO(4)(3- ) , sodium citrate , sodium bisulphite , oxidate DOPAMINE , starch , lactose , carbamide and gelatin , could not PRODUCE INTERFERENCE when their concentrations were 1000-fold than those of dopamine .	...dopamine , starch , lactose , carbamide and gelatin , could not produce interference when...
alter	39	transmission	In contrast , DOPAMINE did not ALTER inhibitory synaptic TRANSMISSION arising from either dLGN interneurons or thalamic reticular nucleus neurons .	...dopamine did not alter inhibitory synaptic transmission arising...
reduced	20	amplitude	Furthermore , DOPAMINE also REDUCED the frequency but not the AMPLITUDE of miniature excitatory postsynaptic currents .	...dopamine also reduced the frequency but not the amplitude of...
improved	51	coupling	Dobutamine ( 4 microM ) worsened , whereas DOPAMINE ( 8 microM ) IMPROVED Ca2 + -contraction COUPLING before and after IR injury .	...dopamine ( 8 microM ) improved Ca2 + -contraction coupling before...
improved	51	cooperativity	Dobutamine and DOPAMINE IMPROVED COOPERATIVITY of contraction and relaxation after IR injury , whereas only dopamine increased cooperativity of relaxation before IR injury .	...dopamine improved cooperativity of...
increased	1	cooperativity	Dobutamine and dopamine improved cooperativity of contraction and relaxation after IR injury , whereas only DOPAMINE INCREASED COOPERATIVITY of relaxation before IR injury .	...dopamine increased cooperativity of...
have	9	role	Norepinephrine and DOPAMINE HAVE important ROLE in movement disorders but their role in movement disorders associated with Japanese encephalitis ( JE ) has not been evaluated .	...dopamine have important role in...
play	6	role	Monoamines , 5-hydroxytryptamine or serotonin ( 5-HT ) , norepinephrine ( NE ) , and DOPAMINE ( DA ) PLAY an important modulatory ROLE in the CNS and are involved in numerous physiological functions and pathological conditions .	...dopamine ( DA ) play an important modulatory role in...
mediate	37	some	Reduced nigrothalamic DOPAMINE and altered thalamic D2 receptors may MEDIATE SOME of the non-motor symptoms of DLB and PDD .	...dopamine and altered thalamic D2 receptors may mediate some of...
has	4	effects	It has been hypothesized that cytoplasmic DOPAMINE HAS subacute toxic EFFECTS in Parkinson Disease ( PD ) leading to neuronal death and clinical symptoms .	...dopamine has subacute toxic effects in...
potentiate	-1	dyskinesias	Focal striatal DOPAMINE may POTENTIATE DYSKINESIAS in parkinsonian monkeys .	...dopamine may potentiate dyskinesias in...
affect	19	structure	Our results suggest that exogenously introduced stress as well as endogenous DOPAMINE could AFFECT the native STRUCTURE of parkin , promote its misfolding , and concomitantly compromise its protective functions .	...dopamine could affect the native structure of...
controls	68	secretion	Although much is known about the mechanisms by which DOPAMINE , the major regulator of lactotrope function , CONTROLS hormone production and SECRETION , its growth inhibiting actions have remained less well characterized .	...dopamine , the major regulator of lactotrope function , controls hormone production and secretion ,...
regulates	22	induction	Consistent with network models , these results demonstrate that DOPAMINE REGULATES the INDUCTION of a Hebbian form of long-term synaptic plasticity in the striatum .	...dopamine regulates the induction of...
phosphorylates	-1	acid	Finally , since the cAMP-EPAC-Rap1 pathway also activates DARPP32 ( 32-kDa dopamine response protein phosphatase ) , we confirmed that DOPAMINE PHOSPHORYLATES DARPP32 , and okadaic ACID , which blocks phosphatases ( DARPP32 ) , also blocks dopamine 's effect .	...dopamine phosphorylates DARPP32 , and okadaic acid ,...
increases	17	molecules	In summary , DOPAMINE INCREASES ENaC activity by a cAMP-mediated alternative signaling pathway involving EPAC and Rap1 , signaling MOLECULES usually associated with growth-factor-activated receptors .	...dopamine increases ENaC activity by a cAMP-mediated alternative signaling pathway involving EPAC and Rap1 , signaling molecules usually...
modulates	10	projection	These data suggest that DOPAMINE presynaptically MODULATES the subthalamic PROJECTION that targets GABAergic neurons of the SNr .	...dopamine presynaptically modulates the subthalamic projection that...
induced	12	responses	Consistently , DOPAMINE selectively INDUCED chemotactic RESPONSES in naive CD8 + T cells of both humans and mice in a manner sensitive to pertussis toxin and D3 antagonists .	...dopamine selectively induced chemotactic responses in...
plays	3	role	Collectively , naive CD8 + T cells selectively express D3 in both humans and mice , and DOPAMINE PLAYS a significant ROLE in migration and homing of naive CD8 + T cells via D3 .	...dopamine plays a significant role in...
reveal	-1	responses	Simultaneous DOPAMINE and single-unit recordings REVEAL accumbens GABAergic RESPONSES : implications for intracranial self-stimulation .	...dopamine and single-unit recordings reveal accumbens GABAergic responses :...
retained	-1	potency	Replacement of the vanillyl headgroup of PhAR with various aromatic or alkyl amino groups decreased activity at TRPV1 receptors , although the DOPAMINE , cyclopropylamine , 1'-(R)- and 1'-(S)-methyl-ethanolamine , and ethanolamine derivatives RETAINED significant POTENCY ( EC(50 ) 31 - 126 nM ) .	...dopamine , cyclopropylamine , 1'-(R)- and 1'-(S)-methyl-ethanolamine , and ethanolamine derivatives retained significant potency (...
plays	3	role	Recent evidence suggests that DOPAMINE PLAYS an important ROLE in arousal , but the location of the dopaminergic neurons that may regulate arousal remains unclear .	...dopamine plays an important role in...
excites	106	interneurons	However , DOPAMINE EXCITES most amygdala INTERNEURONS , suggesting that this dopaminergic gate may be mediated by an unknown subpopulation of interneurons .	...dopamine excites most amygdala interneurons ,...
enhances	36	tendency	The present study demonstrates that chronically elevated DOPAMINE ENHANCES TENDENCY to work for a food reward without apparent effects on Pavlovian and operant learning for this reward .	...dopamine enhances tendency to...
have	9	role	Both glucocorticoid hormones and DOPAMINE HAVE an important ROLE in maintaining normal brain functions .	...dopamine have an important role in...
plays	3	role	The neurotransmitter/neuromodulator DOPAMINE PLAYS an important ROLE in both the central nervous system and the periphery .	...dopamine plays an important role in...
have	9	effects	Further , with GABA , serotonin , DOPAMINE and acetylcholine transmissions HAVE differential EFFECTS on early cortical and pre-attentional processing in the auditory and frontal cortices .	...dopamine and acetylcholine transmissions have differential effects on...
mediates	24	maintenance	Nucleus accumbens DOPAMINE differentially MEDIATES the formation and MAINTENANCE of monogamous pair bonds .	...dopamine differentially mediates the formation and maintenance of...
decreased	23	calcium	On the other hand , DOPAMINE DECREASED cell membrane depolarization as well as cytosolic CALCIUM increases evoked by glucose stimulation in INS-1E beta cells .	...dopamine decreased cell membrane depolarization as well as cytosolic calcium increases...
facilitates	48	behavior	The neurotransmitter DOPAMINE ( DA ) FACILITATES male sexual BEHAVIOR in all studied species , including rodents and humans .	...dopamine ( DA ) facilitates male sexual behavior in...
increased	1	%	In microdialysis tests during the first sugar meal on days 1 , 2 and 21 , extracellular DOPAMINE INCREASED at least 30 % each day in both groups .	...dopamine increased at least 30 % each...
had	5	interferences	Furthermore , uric acid ( UA ) , ascorbic acid ( AA ) and DOPAMINE ( DA ) HAD little INTERFERENCES with the amperometric signal of H(2)O(2 ) , which provide the perspective of this H(2)O(2 ) sensor to be used in biological environments .	...dopamine ( DA ) had little interferences with...
constituted	-1	average	Our results indicated that DOPAMINE , which CONSTITUTED an AVERAGE of 4.4 % of the alga 's dry mass , was responsible for decreased feeding by sea urchins ( Strongylocentrotus droebachiensis ) .	...dopamine , which constituted an average of...
reduced	20	isopods	Subsequent experiments demonstrated that DOPAMINE also REDUCED the feeding rates of snails ( Littorina sitkana ) and ISOPODS ( Idotea wosnesenskii ) .	...dopamine also reduced the feeding rates of snails ( Littorina sitkana ) and isopods (...
potentiates	103	transmission	Under the assumption that DOPAMINE POTENTIATES corticostriatal synaptic TRANSMISSION , we demonstrate that , in our model , moderate dopamine depletion leads to a complete loss of action selection ability .	...dopamine potentiates corticostriatal synaptic transmission ,...
worsens	-1	perfusion	' Low-dose ' DOPAMINE WORSENS renal PERFUSION in patients with acute renal failure .	...dopamine worsens renal perfusion in...
induced	12	vasoconstriction	Subgroup analysis of patients with ARF revealed that DOPAMINE INDUCED renal VASOCONSTRICTION above 55 years ( n=22 ) and in patients not receiving norepinephrine ( n=20 ) .	...dopamine induced renal vasoconstriction above...
worsen	-1	perfusion	In conclusion ' low-dose ' DOPAMINE can WORSEN renal PERFUSION in patients with ARF , which adds to the rationale for abandoning the routine use of ' low-dose ' dopamine in critically ill patients .	...dopamine can worsen renal perfusion in...
slows	-1	rhythm	In an excised Wistar rat medulla-spinal cord block preparation we previously found that DOPAMINE SLOWS respiratory RHYTHM by activation of dopamine D(4 ) receptors [ Fujii et al. , (2004)Neurosci .	...dopamine slows respiratory rhythm by...
depressed	71	activity	In addition to slowing the rhythm , DOPAMINE DEPRESSED respiratory ACTIVITY of Pre-I neurons collectively but not that of I neurons .	...dopamine depressed respiratory activity of...
mediate	37	behaviors	A large body of data indicates that opioids and DOPAMINE together MEDIATE emotional and reinforced BEHAVIORS .	...dopamine together mediate emotional and reinforced behaviors ....
represses	-1	expression	Under normal conditions DOPAMINE REPRESSES the ACTH EXPRESSION .	...dopamine represses the ACTH expression ....
affect	19	oxidation	We conclude that DOPAMINE may AFFECT NADH and NADPH OXIDATION directly .	...dopamine may affect NADH and NADPH oxidation directly...
have	9	interactions	Since the NE , DOPAMINE and serotonin systems HAVE reciprocal INTERACTIONS , it is virtually impossible to act on a specific neuronal element without affecting in a cascade effect the two other systems .	...dopamine and serotonin systems have reciprocal interactions ,...
inhibits	0	uptake	5-HT , the other endogenous amine of the granules , and DOPAMINE and tyramine , which do not occur naturally in rat mast cells , each competitively INHIBITS [3H]-histamine UPTAKE with Ki 's close to 1 microM. Reserpine , a putative amine carrier blocker , inhibits uptake at nanomolar concentrations .	...dopamine and tyramine , which do not occur naturally in rat mast cells , each competitively inhibits [3H]-histamine uptake with...
augment	-1	secretion	Role of dopamine in the regulation of growth hormone secretion : DOPAMINE and bromocriptine AUGMENT growth hormone (GH)-releasing hormone-stimulated GH SECRETION in normal man .	...dopamine and bromocriptine augment growth hormone (GH)-releasing hormone-stimulated GH secretion in...
inhibited	2	firing	However , DOPAMINE INHIBITED the glutamate-induced FIRING in 31 of 32 CN neurons that were not spontaneously active .	...dopamine inhibited the glutamate-induced firing in...
reverse	-1	oliguria	Clinical studies revealed that low-dose DOPAMINE can REVERSE OLIGURIA , but these studies were poorly controlled , were confounded by the use of other diuretics , had small patient populations , and often did not evaluate mortality or long-term renal function .	...dopamine can reverse oliguria ,...
provides	83	inhibition	This response did not occur in carotid body denervated goats supporting the hypothesis that endogenous DOPAMINE PROVIDES tonic INHIBITION in the carotid body .	...dopamine provides tonic inhibition in...
stimulated	14	secretion	It was discovered that isadrin , DOPAMINE , complamin , calcium gluconate , euphylline and papaverine STIMULATED the pancreatic SECRETION of lipase and trypsin .	...dopamine , complamin , calcium gluconate , euphylline and papaverine stimulated the pancreatic secretion of...
increased	1	pressure	Ca++ and DOPAMINE also INCREASED the blood PRESSURE whereas isoproterenol accelerated the escape rhythm .	...dopamine also increased the blood pressure whereas...
decreases	41	resistance	We conclude that DOPAMINE DECREASES total renal vascular RESISTANCE while amino acids mainly reduce the tone of afferent arterioles .	...dopamine decreases total renal vascular resistance while...
modulates	10	reward	The fact that pimozide reduced the value of reward in an area containing only marginal amounts of dopaminergic cells adds support to the hypothesis that DOPAMINE MODULATES REWARD indirectly .	...dopamine modulates reward indirectly...
induce	27	depolarization	Serotonin ( 5HT ) and DOPAMINE ( DA ) INDUCE , in neuroblastoma N1E-115 cells , a transient membrane DEPOLARIZATION associated with an inward current .	...dopamine ( DA ) induce , in neuroblastoma N1E-115 cells , a transient membrane depolarization associated...
reduces	42	copper	Use of substrate dopamine as the sole reductant is found to lead to a highly unusual kinetic independence of oxygen concentration , as well as significantly reduced values of Vmax and V/KDA , and we conclude that DOPAMINE REDUCES enzymic COPPER in a rate-limiting step that is 40-fold slower than with ascorbate .	...dopamine reduces enzymic copper in...
reduced	20	sensitivity	In general , DOPAMINE ( 20 - 250 microM ) REDUCED the overall SENSITIVITY of ganglion cells to light stimuli while increasing the spontaneous activity of off-center cells and decreasing the spontaneous activity of on-center cells and on-off directionally selective cells .	...dopamine ( 20 - 250 microM ) reduced the overall sensitivity of...
increased	1	VR	In the absence of total spinal anesthesia , both DOPAMINE and dobutamine INCREASED VR ( decreased venous capacitance ) in a dose-dependent manner .	...dopamine and dobutamine increased VR (...
