verb	verb_id	object	sentence	phrase
exhibited	55	differences	With regard to regional patterns , DOPAMINE EXHIBITED major DIFFERENCES in the mediolateral axis of the anterior dorsal ventricular ridge : dopaminergic innervation was densest in the lateral region , which in other reptiles is described as a target of visual thalamic projections .	...dopamine exhibited major differences in...
displaced	100	binding	We found that , in membranes of postmortem human striatum , amygdala , frontal cortex and substantia nigra , neither DOPAMINE nor the dopamine agonist apomorphine DISPLACED the BINDING of [3H]clozapine ( 5 - 20 nM ) .	...dopamine nor the dopamine agonist apomorphine displaced the binding of...
increased	1	REE	The results of this study revealed that low-dose DOPAMINE INCREASED REE in postsurgical patients and that this might be associated with the concomitant increase in plasma glucagon .	...dopamine increased REE in...
inhibits	0	release	Hypothalamic DOPAMINE ( DA ) tonically INHIBITS prolactin ( PRL ) RELEASE from the anterior pituitary gland , whereas removal of DA markedly augments its release to values exceeding pre-DA rates .	...dopamine ( DA ) tonically inhibits prolactin ( PRL ) release from...
produced	7	effect	D-DOPA , DOPAMINE , noradrenaline or adrenaline ( 300 ng ) PRODUCED no EFFECT .	...dopamine , noradrenaline or adrenaline ( 300 ng ) produced no effect ....
inhibited	2	activity	In the isolated proximal convoluted tubule , DOPAMINE INHIBITED Na+,K(+)-ATPase ACTIVITY in both the 10-d-old ( 34 + /- 3 % , p & lt ; 0.001 ) and 40-d-old rats ( 44 + /- 7 % , p & lt ; 0.001 ) .	...dopamine inhibited Na+,K(+)-ATPase activity in...
stimulates	16	release	Previously , we have demonstrated that DOPAMINE ( DA ) STIMULATES growth hormone ( GH ) RELEASE from the goldfish pituitary through DA D1 receptors .	...dopamine ( DA ) stimulates growth hormone ( GH ) release from...
exhibited	55	efficacy	In the presence of the A2a agonist (2-p-carboxyethyl)phenylamino-5'-N carboxamidoadenosine , DOPAMINE EXHIBITED a lower EFFICACY in displacing the radiolabelled D2 receptor antagonist [125I]iodosulpiride from the rat ventral striatum , specially in the nucleus accumbens .	...dopamine exhibited a lower efficacy in...
modulate	15	activity	These results support the notion that DOPAMINE can MODULATE epileptiform ACTIVITY differentially , through its actions at D1 and D2 receptors .	...dopamine can modulate epileptiform activity differentially...
plays	3	role	Therefore DOPAMINE PLAYS an important ROLE in regulating the epileptic seizures .	...dopamine plays an important role in...
plays	3	roles	These results suggest that DOPAMINE PLAYS different ROLES in MDMA and amphetamine CTAs , and that the D1 and D2 receptors independently mediate the aversive effect of amphetamine in CTA .	...dopamine plays different roles in...
exert	28	control	Does DOPAMINE EXERT a tonic inhibitory CONTROL on the release of striatal acetylcholine in vivo ?	...dopamine exert a tonic inhibitory control on...
facilitates	48	release	These results indicate that , in normal circumstances , endogenous DOPAMINE FACILITATES striatal acetylcholine RELEASE through dopamine D1 receptors .	...dopamine facilitates striatal acetylcholine release through...
caused	8	reduction	2 . In normal , anaesthetized rats , DOPAMINE as well as its prodrugs CAUSED a dose-dependent REDUCTION of vascular resistance in the kidney ( RR ) , mesentery ( MR ) and hindquarters ( HQR ) ( dose range : dopamine : 0.1 - 5 mumol kg-1 h-1 ; L-dopa and gludopa : 1 - 200 mumol kg-1 h-1 ) .	...dopamine as well as its prodrugs caused a dose-dependent reduction of...
mediates	24	response	The objective of this study was to determine whether norepinephrine ( NE ) or DOPAMINE ( DA ) MEDIATES the LH RESPONSE to blockade of MBH kappa-opioid receptors on days 13 - 17 of pregnancy in the rat .	...dopamine ( DA ) mediates the LH response to...
change	69	GFR	With and without metoprolol , DOPAMINE did not significantly CHANGE GFR , and the percentage increases in ERPF were similar on the two study days ( 40 % ( P & lt ; 0.001 ) and 42 % ( P & lt ; 0.001 ) , respectively ) .	...dopamine did not significantly change GFR ,...
prevented	56	[3H]SCH	As previously described , DOPAMINE PREVENTED [3H]SCH 23390 binding in a mixed competitive/non-competitive manner , causing both a loss of ligand affinity and a decrease in Bmax .	...dopamine prevented [3H]SCH 23390...
accelerate	-1	rate	Under neither condition did DOPAMINE ACCELERATE the RATE of ligand dissociation , indicating that dopamine does not interact allosterically with [3H]SCH 23390 binding sites .	...dopamine accelerate the rate of...
masks	-1	binding	These data , therefore , preclude an allosteric mechanism to explain the dopamine-induced decrease in dopamine D1 receptor density and provide direct evidence that DOPAMINE MASKS ligand BINDING by binding to a high affinity site which can be modulated by Gpp(NH)p and Na+ .	...dopamine masks ligand binding by...
modulated	101	currents	We used whole-cell patch recording to measure how bath-applied DOPAMINE MODULATED the CURRENTS elicited by puffs of transmitter solutions at bipolar cell dendrites .	...dopamine modulated the currents elicited...
enhanced	33	response	Bath-applied DOPAMINE ( 20 microM ) ENHANCED the RESPONSE to glutamate in OFF bipolar cells in the retinal slice by 40 % and in isolated OFF bipolar cells by 65 % .	...dopamine ( 20 microM ) enhanced the response to...
modulate	15	transmission	Thus , DOPAMINE may MODULATE synaptic TRANSMISSION from photoreceptors to OFF bipolar cells .	...dopamine may modulate synaptic transmission from...
plays	3	role	That DOPAMINE ( DA ) PLAYS a ROLE in reward-related learning is well documented but the mechanisms through which it acts are not well understood .	...dopamine ( DA ) plays a role in...
decreased	23	in	PGI2 and DOPAMINE significantly DECREASED gastric lesions IN the 3-month rats but not in 12-month old rats .	...dopamine significantly decreased gastric lesions in the...
had	5	effect	PGI2 or DOPAMINE HAD any EFFECT on the 12-month old rats .	...dopamine had any effect on...
modulates	10	activity	In a previous study , we showed that DOPAMINE also MODULATES ACTIVITY of the corticosteroid receptor system .	...dopamine also modulates activity of...
increases	17	phosphorylation	Using an antiserum specific for CREB phosphorylated at Ser-133 , we found that DOPAMINE INCREASES CREB PHOSPHORYLATION in cultured striatal neurons .	...dopamine increases CREB phosphorylation in...
induces	18	decrease	The in vitro studies demonstrated that DOPAMINE INDUCES a significant DECREASE ( p & lt ; 0.05 ) in the total number of VIP-immunoreactive cells , which were smaller than the cells from the control dishes , because dopamine induces a significant decrease in their cellular , cytoplasmic and nuclear areas ( p & lt ; 0.01 ) .	...dopamine induces a significant decrease (...
induce	27	constriction	However , DOPAMINE even at lower doses , may INDUCE CONSTRICTION of the intestinal mucosal arterioles .	...dopamine even at lower doses , may induce constriction of...
cause	47	damage	We show that L-DOPA , DOPAMINE and 3-O-methyl-DOPA CAUSE extensive oxidative DNA DAMAGE in the presence of H2O2 and traces of copper ions .	...dopamine and 3-O-methyl-DOPA cause extensive oxidative DNA damage in...
increased	1	output	In the normal acid-base state , both db-cAMP and DOPAMINE significantly INCREASED cardiac OUTPUT and decreased systemic vascular resistance ( SVR ) .	...dopamine significantly increased cardiac output and...
produce	52	SVR	During metabolic acidosis , db-cAMP increased cardiac output by 69 + /- 14 % and decreased SVR by 36 + /- 2 % , while DOPAMINE did not PRODUCE changes in cardiac output and increased SVR .	...dopamine did not produce changes in cardiac output and increased SVR ....
increased	1	concentration	During metabolic acidosis , DOPAMINE significantly INCREASED the plasma CONCENTRATION of epinephrine and norepinephrine , while db-cAMP significantly decreased epinephrine concentration .	...dopamine significantly increased the plasma concentration of...
exerts	11	control	It is proposed that endogenous DOPAMINE EXERTS an inhibitory CONTROL on alpha-MSH release from the rat hypothalamus via D2-dopamine receptors and that in isolated hypothalamic slices there is a tonic inhibition of peptide release due to the activity of this system .	...dopamine exerts an inhibitory control on...
increased	1	breakdown	4 . In striatal and hippocampal miniprisms , DOPAMINE also INCREASED inositol phospholipid BREAKDOWN , albeit only at high ( greater than or equal to 1 mM ) concentrations .	...dopamine also increased inositol phospholipid breakdown ,...
alter	39	mobility	Dopamine inhibited the O2- production by PMNs when PMNs were stimulated with N-formylated chemotactic peptide N-formyl-methionyl-leucyl-phenylalanine ( FMLP ) , phorbol myristate acetate , or opsonized zymosan , whereas DOPAMINE did not ALTER the PMN MOBILITY .	...dopamine did not alter the PMN mobility ....
inhibited	2	production	Furthermore , DOPAMINE INHIBITED the reduced nicotinamide-adenine dinucleotide phosphate-dependent O2- PRODUCTION by subcellular particles .	...dopamine inhibited the reduced nicotinamide-adenine dinucleotide phosphate-dependent O2- production by...
inhibits	0	production	These results indicate that DOPAMINE INHIBITS PMN O2- PRODUCTION through its effect on PMN reduced nicotinamide-adenine dinucleotide phosphate-oxidase system rather than through its beta-adrenergic action .	...dopamine inhibits PMN O2- production through...
increases	17	production	Our results suggest that DOPAMINE INCREASES cAMP PRODUCTION in afferent arterioles via the DA1 receptor .	...dopamine increases cAMP production in...
stimulate	25	accumulation	Both DOPAMINE and the beta-adrenergic agonist isoproterenol STIMULATE cyclic AMP ACCUMULATION in this retina , but serotonin , an indoleamine , and phenylephrine , an alpha-adrenergic agonist , had no effect .	...dopamine and the beta-adrenergic agonist isoproterenol stimulate cyclic AMP accumulation in...
altered	72	magnitude	Neither DOPAMINE nor bromocriptine ALTERED the rate or MAGNITUDE of TRH- , AII- , NTS- , or BBS-related InsPx generation .	...dopamine nor bromocriptine altered the rate or magnitude of...
attenuates	96	phosphorylation	It is our conclusion that DOPAMINE , in addition to its other actions , ATTENUATES the PHOSPHORYLATION , rather than the hydrolysis , of anterior pituitary phosphoinositide .	...dopamine , in addition to its other actions , attenuates the phosphorylation ,...
modulate	15	excitation	Endogenous DOPAMINE and dopaminergic agonists MODULATE synaptic EXCITATION in neostriatum : intracellular studies from naive and catecholamine-depleted rats .	...dopamine and dopaminergic agonists modulate synaptic excitation in...
produced	7	decrease	D-Amphetamine ( 0.1 - 5 microM ) , as well as DOPAMINE , PRODUCED a dose-dependent DECREASE of the excitatory synaptic potentials .	...dopamine , produced a dose-dependent decrease of...
mimics	95	reduction	We conclude that in naive animals endogenous DOPAMINE MIMICS the voltage-dependent REDUCTION of synaptic excitation produced by D1 activation , while in catecholamine-depleted rats dopamine lacks its voltage-dependent effect and interacts with " supersensitive " D2 receptors .	...dopamine mimics the voltage-dependent reduction of...
lacks	-1	effect	We conclude that in naive animals endogenous dopamine mimics the voltage-dependent reduction of synaptic excitation produced by D1 activation , while in catecholamine-depleted rats DOPAMINE LACKS its voltage-dependent EFFECT and interacts with " supersensitive " D2 receptors .	...dopamine lacks its voltage-dependent effect and...
induce	27	contractions	Exogenous DOPAMINE ( DA ) , octopamine ( OA ) , noradrenaline ( NA ) , and the alpha 1-agonist methoxamine ( MX ) , all INDUCE tonic and rhythmic CONTRACTIONS in the rat vas deferens .	...dopamine ( DA ) , octopamine ( OA ) , noradrenaline ( NA ) , and the alpha 1-agonist methoxamine ( MX ) , all induce tonic and rhythmic contractions in...
has	4	effect	Significant reductions in somatostatin and neuropeptide Y release coincided with increased dopamine release , suggesting that DOPAMINE HAS an inhibitory EFFECT on the release of both peptides .	...dopamine has an inhibitory effect on...
produced	7	changes	DOPAMINE alone PRODUCED variable and small CHANGES in FBF .	...dopamine alone produced variable and small changes in...
induces	18	vasodilatation	DOPAMINE INDUCES forearm VASODILATATION following alpha-adrenoceptor blockade by an action on vascular dopamine ( DA1 ) receptors similar to those described in the renal and mesenteric vasculature of other species .	...dopamine induces forearm vasodilatation following...
inhibit	13	transmission	These results show that DOPAMINE and selective DA-1 and DA-2 receptor agonists INHIBIT ganglionic TRANSMISSION by activating two distinct subtypes of dopamine receptors located on sympathetic ganglia .	...dopamine and selective DA-1 and DA-2 receptor agonists inhibit ganglionic transmission by...
had	5	action	It is concluded that DOPAMINE HAD no detectable ACTION on protein secretion and that the physiological role of dopamine with respect to pancreatic secretion is still questionable .	...dopamine had no detectable action on...
induced	12	H-response	The DOPAMINE INDUCED H-RESPONSE is blocked by (-)-sulpiride , 4-aminopyridine , dibutyryl cAMP , 8CPT-cAMP , forskolin and IBMX .	...dopamine induced H-response is...
induces	18	H-response	These data suggest that DOPAMINE INDUCES the H-RESPONSE by stimulating a receptor resembling the mammalian D-2 receptor and that this effect of dopamine is mediated by a decrease in the formation of intracellular cAMP .	...dopamine induces the H-response by...
inhibited	2	secretion	In the presence of forskolin ( 0.1 - 10 microM ) , DOPAMINE ( 0.1 microM ) INHIBITED prolactin SECRETION to below the basal level and considerably attenuated the stimulation of growth hormone secretion .	...dopamine ( 0.1 microM ) inhibited prolactin secretion to...
decreased	23	of	However , neither DOPAMINE nor somatostatin significantly DECREASED the stimulatory effect of forskolin on cellular cyclic AMP accumulation.(ABSTRACT TRUNCATED AT 250 WORDS ) The effects OF ethane dimethane sulphonate ( EDS ) on bilaterally cryptorchid rat testes .	...dopamine nor somatostatin significantly decreased the stimulatory effect of forskolin on cellular cyclic AMP accumulation.(ABSTRACT TRUNCATED AT 250 WORDS ) The effects of ethane...
block	-1	activation	The observations that DOPAMINE and apomorphine can BLOCK forskolin ACTIVATION of tyrosine hydroxylase , that this blockade can in turn be prevented by preincubation with haloperidol or chlorpromazine , and that the amount of dopamine required for blockade of forskolin activation in synaptosomes has no effect on tyrosine hydroxylase when added to the enzyme assay constitute the first clear evidence of a presynaptic dopamine receptor ( autoreceptor ) .	...dopamine and apomorphine can block forskolin activation of...
had	5	effect	On the other hand DOPAMINE ( 4 - 20 micrograms ) and serotonin ( 8 and 20 micrograms ) HAD no EFFECT on ethanol diuresis when given intraventricularly .	...dopamine ( 4 - 20 micrograms ) and serotonin ( 8 and 20 micrograms ) had no effect on...
enhances	36	accumulation	It is concluded that : the increase in dopamine-stimulated cyclic AMP efflux caused by D2 antagonists reflects increased intracellular cyclic AMP accumulation rather than an effect on the efflux mechanism ; DOPAMINE ENHANCES cyclic AMP ACCUMULATION via a D1 receptor , and simultaneously inhibits it through a D2 receptor ; and changes in D1 receptor-stimulated cyclic AMP formation in striatum may not be related to the clinical actions of neuroleptics .	...dopamine enhances cyclic AMP accumulation via...
caused	8	increase	Isoproterenol , norepinephrine and epinephrine , but not DOPAMINE , CAUSED statistically significant INCREASE in aldosterone release .	...dopamine , caused statistically significant increase in...
activate	43	cyclase	Serotonin ( 5-hydroxytryptamine ; 5-HT ) , DOPAMINE ( DA ) , and small cardioactive peptide B ( SCPB ) can ACTIVATE adenylate CYCLASE and increase the intracellular cyclic AMP ( cAMP ) levels in the Limax procerebrum ( PC ) , with differing time courses and to differing extents .	...dopamine ( DA ) , and small cardioactive peptide B ( SCPB ) can activate adenylate cyclase and...
has	4	effect	The results suggest that DOPAMINE HAS a presynaptic stimulatory EFFECT in rat parotid gland , and that the presynaptic effect on potassium efflux seems to be mediated via the D-1 receptor subtype .	...dopamine has a presynaptic stimulatory effect in...
exerts	11	influence	These results suggest that DOPAMINE EXERTS a modulatory INFLUENCE on the metabolism of dynorphin in the striatonigral pathway .	...dopamine exerts a modulatory influence on...
modifies	-1	aspects	Exogenously applied DOPAMINE MODIFIES several ASPECTS of horizontal cell activity in the intact retina , including the responsiveness of these neurons to light and the strength of electrical coupling between them .	...dopamine modifies several aspects of...
alter	39	light-responsiveness	We have used whole-cell voltage clamp methods to examine whether DOPAMINE can ALTER the LIGHT-RESPONSIVENESS of horizontal cells by changing their sensitivity to the neurotransmitter released by the photoreceptors .	...dopamine can alter the light-responsiveness of...
enhance	63	conductances	We report that DOPAMINE and cyclic AMP , although having little direct effect on resting membrane conductance , greatly ENHANCE ionic CONDUCTANCES gated by kainate , an agonist of the transmitter released by the photoreceptors , and by L-glutamate , the agent proposed to be the photoreceptor transmitter .	...dopamine and cyclic AMP , although having little direct effect on resting membrane conductance , greatly enhance ionic conductances gated...
inhibited	2	release	Epinephrine and serotonin stimulated TSH release , and DOPAMINE and somatostatin INHIBITED TRH-stimulated TSH RELEASE .	...dopamine and somatostatin inhibited TRH-stimulated TSH release ....
inhibited	2	release	Noradrenaline and DOPAMINE ( 0.1 - 100 microM ) INHIBITED 45Ca2 + uptake and glutamate RELEASE induced by veratrine ( 25 microM ) in cortical and striatal slices but were without effect when added alone .	...dopamine ( 0.1 - 100 microM ) inhibited 45Ca2 + uptake and glutamate release induced...
produces	32	effects	The results indicate that DOPAMINE PRODUCES multiple physiological EFFECTS on cone horizontal cells by activation of an intracellular enzyme system .	...dopamine produces multiple physiological effects on...
injected	-1	increases	At different levels of the holding potential on neuron R2 membrane in the Aplysia depilans abdominal ganglion , DOPAMINE INJECTED intracellularly INCREASES the amplitude of both inward and outward currents recorded in response to the application of acetylcholine ( ACh ) to the ganglion surface .	...dopamine injected intracellularly increases the...
increased	1	content	In quiescent cells , epinephrine ( EN ) and DOPAMINE ( DA ) markedly INCREASED the NGF CONTENT in the conditioned medium ( CM ) .	...dopamine ( DA ) markedly increased the NGF content in...
inhibits	0	secretion	Serum concentrations of GtH were increased by sGnRH-A in a dose-related fashion ; a low dose of domperidone substantially increased the sensitivity of the serum GtH response to sGnRH-A. These results indicate that DOPAMINE INHIBITS GtH SECRETION from the goldfish pituitary by acting through a specific mechanism mediated by a dopamine D2 receptor .	...dopamine inhibits GtH secretion from...
influence	34	effect	The data also suggest that DOPAMINE and GnRH , although acting through different receptors , INFLUENCE the EFFECT of each other on GtH release .	...dopamine and GnRH , although acting through different receptors , influence the effect of...
inhibited	2	release	In particular , DOPAMINE completely INHIBITED the RELEASE stimulated by forskolin .	...dopamine completely inhibited the release stimulated...
plays	3	role	To investigate whether DOPAMINE PLAYS a ROLE in the regulation of aldosterone secretion during long-term blockade of the renin-angiotensin system , we studied the effect of metoclopramide , a competitive antagonist of dopamine , in 6 patients with essential hypertension chronically treated with the angiotensin converting enzyme inhibitor enalapril .	...dopamine plays a role in...
exerts	11	effect	The increase in plasma aldosterone following competitive dopamine blockade in the face of chronic angiotensin converting enzyme inhibition , unchanged plasma potassium and ACTH levels strongly suggests that in hypertensive patients , DOPAMINE EXERTS a direct inhibitory EFFECT on aldosterone secretion .	...dopamine exerts a direct inhibitory effect on...
increased	1	potential	At micromolar concentrations , DOPAMINE , a retinal neurotransmitter , INCREASED the standing POTENTIAL of the eye .	...dopamine , a retinal neurotransmitter , increased the standing potential of...
abolished	-1	response	At slightly higher concentrations , DOPAMINE ABOLISHED the " light peak , " a slow voltage RESPONSE to light generated by the retinal pigment epithelium .	...dopamine abolished the " light peak , " a slow voltage response to...
modulate	15	productions	Angiotensin II and DOPAMINE MODULATE both cAMP and inositol phosphate PRODUCTIONS in anterior pituitary cells .	...dopamine modulate both cAMP and inositol phosphate productions in...
inhibit	13	activity	Despite their opposite effects on prolactin secretion , both DOPAMINE and angiotensin II INHIBIT adenylate cyclase ACTIVITY in homogenates of anterior pituitary cells in primary culture .	...dopamine and angiotensin II inhibit adenylate cyclase activity in...
regulate	26	release	Serotonin and DOPAMINE independently REGULATE pituitary beta-endorphin RELEASE in vivo .	...dopamine independently regulate pituitary beta-endorphin release in...
inhibits	0	secretion	This study was done to define the concentration of DOPAMINE ( DA ) that INHIBITS gonadotropin SECRETION and to study the effect of DA D-2 receptor blockade during the infusions .	...dopamine ( DA ) that inhibits gonadotropin secretion and...
inhibit	13	secretion	The postulation that DOPAMINE ( DA ) may tonically INHIBIT aldosterone ( ALDO ) SECRETION has arisen from the finding that metoclopramide , a non-selective DA receptor antagonist with prominent non-dopaminergic actions , stimulates ALDO secretion .	...dopamine ( DA ) may tonically inhibit aldosterone ( ALDO ) secretion has...
produce	52	change	These results suggest that DOPAMINE may PRODUCE CHANGE in the firing patterns of GP neurons by either acting directly or attenuating GABAergic inhibitory transmission from the neostriatum .	...dopamine may produce change in...
decreased	23	rate	On the other hand , dopaminergic drugs , apomorphine , bromocriptine , DOPAMINE , lergotrile and lisuride , DECREASED the RATE of release of IR-beta-Ep .	...dopamine , lergotrile and lisuride , decreased the rate of...
increased	1	release	In contrast , DOPAMINE and DB-cAMP infused during autoregulatory vasodilation INCREASED renin RELEASE without significantly changing PGE2 release .	...dopamine and DB-cAMP infused during autoregulatory vasodilation increased renin release without...
stimulate	25	release	In contrast , DOPAMINE and DB-cAMP STIMULATE renin RELEASE without increasing PGE2 release as previously found for beta-adrenergic stimulation .	...dopamine and DB-cAMP stimulate renin release without...
stimulate	25	GTPase	Opiate and DOPAMINE STIMULATE different GTPASE in striatum : evidence for distinct modulatory mechanisms of adenylate cyclase .	...dopamine stimulate different GTPase in...
had	5	effect	Neither glycine or strychnine , nor DOPAMINE or haloperidol HAD any EFFECT on the spontaneous release .	...dopamine or haloperidol had any effect on...
affect	19	mammotrophs	Calcium , cAMP , and DOPAMINE AFFECT single MAMMOTROPHS assayed by hemolytic plaques .	...dopamine affect single mammotrophs assayed...
inhibits	0	it	Morphine and enkephalin effectively enhance pituitary prolactin release , whereas DOPAMINE INHIBITS IT .	...dopamine inhibits it ....
had	5	effect	In contrast , ACTH , DOPAMINE , serotonin , and beta-endorphin HAD no EFFECT .	...dopamine , serotonin , and beta-endorphin had no effect ....
inhibits	0	activity	Locally formed DOPAMINE INHIBITS Na+-K+-ATPase ACTIVITY in rat renal cortical tubule cells .	...dopamine inhibits Na+-K+-ATPase activity in...
inhibits	0	activity	To determine whether locally formed DOPAMINE INHIBITS Na+-K+-ATPase ACTIVITY in intact cortical tubule cells we studied the effect of L-dopa on ouabain-sensitive oxygen consumption rate ( QO2 ) and 86Rb uptake in renal cortical tubule cell suspensions .	...dopamine inhibits Na+-K+-ATPase activity in...
induce	27	reactions	Furthermore , noradrenaline , histamine , DOPAMINE , angiotensin II , carbachol , and tumor growth factor-beta did not INDUCE phospholipase C REACTIONS .	...dopamine , angiotensin II , carbachol , and tumor growth factor-beta did not induce phospholipase C reactions ....
promote	89	production	Acetylcholine and DOPAMINE PROMOTE the PRODUCTION of platelet activating factor in immature cells of chick embryonic retina .	...dopamine promote the production of...
improved	51	performance	Thus , DOPAMINE and dopexamine hydrochloride IMPROVED overall LV PERFORMANCE .	...dopamine and dopexamine hydrochloride improved overall LV performance ....
modulate	15	action	These results suggest that DOPAMINE may MODULATE the ACTION of NT in the rat cerebral cortex .	...dopamine may modulate the action of...
